{
  "$schema": "https://json-schema.org/draft/2020-12/schema",
  "$id": "https://schemas.ultikits.com/protocol/v2/2.0.0/agent/config.update.schema.json",
  "type": "object",
  "properties": {
    "v": {
      "type": "number",
      "const": 2
    },
    "id": {
      "type": "string",
      "pattern": "^[0-9A-HJKMNP-TV-Z]{26}$"
    },
    "type": {
      "type": "string",
      "const": "config.update"
    },
    "ts": {
      "type": "integer",
      "minimum": 0,
      "maximum": 8640000000000000
    },
    "payload": {
      "type": "object",
      "properties": {
        "path": {
          "type": "string",
          "minLength": 1,
          "maxLength": 512,
          "pattern": "^(?:[^./\\\\:\\u0000-\\u001F][^/\\\\:\\u0000-\\u001F]*|\\.[^./\\\\:\\u0000-\\u001F][^/\\\\:\\u0000-\\u001F]*|\\.\\.[^/\\\\:\\u0000-\\u001F]+)(?:\\/(?:[^./\\\\:\\u0000-\\u001F][^/\\\\:\\u0000-\\u001F]*|\\.[^./\\\\:\\u0000-\\u001F][^/\\\\:\\u0000-\\u001F]*|\\.\\.[^/\\\\:\\u0000-\\u001F]+))*$"
        },
        "baseVersion": {
          "type": "string",
          "pattern": "^[0-9a-f]{64}$"
        },
        "changes": {
          "minItems": 1,
          "maxItems": 500,
          "type": "array",
          "items": {
            "type": "object",
            "properties": {
              "key": {
                "type": "string",
                "minLength": 1,
                "maxLength": 256,
                "pattern": "^[^.\\u0000-\\u001F]+(\\.[^.\\u0000-\\u001F]+)*$"
              },
              "value": {
                "anyOf": [
                  {
                    "type": "string",
                    "maxLength": 8192
                  },
                  {
                    "type": "number"
                  },
                  {
                    "type": "boolean"
                  },
                  {
                    "maxItems": 500,
                    "type": "array",
                    "items": {
                      "type": "string",
                      "maxLength": 1024
                    }
                  },
                  {
                    "type": "null"
                  }
                ]
              }
            },
            "required": [
              "key",
              "value"
            ],
            "additionalProperties": false
          }
        }
      },
      "required": [
        "path",
        "baseVersion",
        "changes"
      ],
      "additionalProperties": false
    }
  },
  "required": [
    "v",
    "id",
    "type",
    "ts",
    "payload"
  ],
  "additionalProperties": false
}
